{
  "name": "fengshui-master-capability-matrix",
  "version": "1.0.0",
  "purpose": "Machine-readable capability and limitation matrix for portable agent routing, user-facing scope disclosure, integration checks, and roadmap triage.",
  "statuses": ["fully_covered", "partially_covered", "not_covered"],
  "capabilities": [
    {
      "id": "consented-proactive-followup",
      "title": "Proactive assessment and consented notification planning with host delivery",
      "status": "partially_covered",
      "domains": ["general", "timing", "life_omen", "career", "finance", "space"],
      "supported_questions": ["review my situation on an agreed schedule", "notify me about meaningful changes", "offer a useful next step from new evidence", "pause or cancel follow-ups"],
      "required_inputs": ["explicit scoped consent", "private channel and recipient", "timezone and agreed schedule or triggers", "fresh permitted evidence or requested review", "latest receipt state"],
      "references": ["fengshui-master/references/proactive-followup-protocol.md", "fengshui-master/references/proactive-reading-protocol.md", "fengshui-master/references/ethics-and-limits.md"],
      "optional_tools": ["fengshui-master/scripts/proactive_checkin.py", "fengshui-master/scripts/personal_context.py"],
      "guardrails": ["do not create unsolicited subscriptions", "do not invent changed fortune", "respect consent revocation and quiet hours", "confirm delivery before acknowledging", "use native-domain evidence before symbolism"],
      "limitations": ["host must supply and verify the scheduler, private transport, source access, locking, durable outbox, and atomic state store", "planner validates policy and structure, not the truth or safety of arbitrary message text", "calendar and personal context helpers are bounded scaffolds, not predictive engines", "no claim of exactly-once network delivery without provider reconciliation"],
      "adaptation_notes": ["Use docs/proactive-host-integration.md and the fictional offline example for integration.", "A chat-only host can offer a review plan but cannot promise a later message.", "Use a stable event key per meaningful change or scheduled occurrence; do not create a fresh key on each poll."]
    },
    {
      "id": "space-form-analysis",
      "title": "Form-school spatial analysis for homes, offices, shops, rooms, and sites",
      "status": "partially_covered",
      "domains": ["space"],
      "supported_questions": ["home layout review", "office desk placement", "shopfront qi flow", "bedroom support and sha qi", "site and entrance form"],
      "required_inputs": ["space type", "floor plan or description", "entrance and circulation", "major furniture or functional zones", "known safety or usability constraints"],
      "references": ["fengshui-master/references/foundation.md", "fengshui-master/references/forms-and-environment.md", "fengshui-master/references/analysis-templates.md", "fengshui-master/references/remedies.md"],
      "optional_tools": ["fengshui-master/scripts/create_brief.py", "fengshui-master/scripts/generate_report.py", "fengshui-master/scripts/analyze_floorplan.py"],
      "guardrails": ["prioritize safety and usability", "separate observation from interpretation", "prefer safe reversible interventions"],
      "limitations": ["the bundled analyzer covers validated rectangular annotations and a limited set of form checks rather than systematic dragon den sand water and facing site evidence", "raw photo, map, GIS, irregular polygon, and computer-vision parsing are not included", "structural engineering and architectural code review are outside scope"],
      "adaptation_notes": ["Use structured floor-plan JSON when repeatability matters.", "Ask for missing measurements before precise spatial claims."]
    },
    {
      "id": "bagua-compass-sector",
      "title": "Later-heaven bagua direction, trigram, phase, and life-area mapping",
      "status": "fully_covered",
      "domains": ["space", "symbolic"],
      "supported_questions": ["directional sector symbolism", "wealth-area language", "relationship-area language", "bearing to bagua mapping"],
      "required_inputs": ["direction or degrees", "chosen bagua method", "context for the sector"],
      "references": ["fengshui-master/references/foundation.md", "fengshui-master/references/schools.md"],
      "optional_tools": ["fengshui-master/scripts/bagua_map.py", "fengshui-master/scripts/luopan.py"],
      "guardrails": ["do not mix bagua methods silently", "do not guarantee wealth health relationship or career outcomes", "label life-area language as symbolism"],
      "limitations": ["symbolic bagua and compass bagua can produce different mappings", "sector mapping alone does not prove auspiciousness"],
      "adaptation_notes": ["Require the agent to name compass, later-heaven, or symbolic bagua before interpreting a sector."]
    },
    {
      "id": "eight-mansions-ming-gua",
      "title": "Eight Mansions ming gua helper and direction grouping",
      "status": "partially_covered",
      "domains": ["space", "personal"],
      "supported_questions": ["common ming gua lookup", "east or west group", "bed or desk direction discussion"],
      "required_inputs": ["birth year", "traditional sex input if using the common formula", "li chun or lunar boundary convention when precision matters", "bed desk or door direction"],
      "references": ["fengshui-master/references/schools.md", "fengshui-master/references/foundation.md"],
      "optional_tools": ["fengshui-master/scripts/minggua.py"],
      "guardrails": ["confirm li chun or lineage-specific year boundary when precision matters", "do not reduce a person to one direction", "prioritize safety comfort and real use"],
      "limitations": ["uses a common simplified ming-gua formula", "does not calculate a complete house-person Eight Mansions chart", "does not replace lineage-specific Eight Mansions consultation"],
      "adaptation_notes": ["Use as a personal-direction scaffold, then check form, comfort, and room function."]
    },
    {
      "id": "ganzhi-year-scaffold",
      "title": "Gregorian-year heavenly stem, earthly branch, zodiac, yin-yang, and phase scaffold",
      "status": "fully_covered",
      "domains": ["timing", "life_omen"],
      "supported_questions": ["year stem branch context", "annual symbolic phase", "zodiac-year framing"],
      "required_inputs": ["Gregorian year", "boundary convention near late January or early February when relevant"],
      "references": ["fengshui-master/references/foundation.md", "fengshui-master/references/life-and-omen-adapter.md"],
      "optional_tools": ["fengshui-master/scripts/ganzhi.py"],
      "guardrails": ["do not present year scaffold as complete bazi", "confirm li chun or lunar-year boundary near transitions", "avoid deterministic fate claims"],
      "limitations": ["not a complete natal chart", "does not calculate month day hour pillars"],
      "adaptation_notes": ["Use only as year-level symbolic context unless a full external bazi engine is supplied."]
    },
    {
      "id": "san-yuan-periods",
      "title": "San Yuan nine-period timing scaffold",
      "status": "fully_covered",
      "domains": ["timing", "xuan_kong"],
      "supported_questions": ["current period context", "Period 9 discussion", "building-period intake"],
      "required_inputs": ["year", "building completion or occupation year if applying to a building", "school convention when precision matters"],
      "references": ["fengshui-master/references/timing-and-date-selection.md", "fengshui-master/references/xuan-kong-flying-stars.md"],
      "optional_tools": ["fengshui-master/scripts/periods.py"],
      "guardrails": ["verify lineage and calendar boundary before exact flying-star work", "do not treat period alone as a complete reading"],
      "limitations": ["covers common 1864-2043 period sequence", "does not automate full building natal chart lineage variants"],
      "adaptation_notes": ["Use as a timing layer, then request facing degree and building data for xuan kong work."]
    },
    {
      "id": "annual-directional-cautions",
      "title": "Annual tai sui, sui po, and san sha directional cautions",
      "status": "fully_covered",
      "domains": ["timing", "space"],
      "supported_questions": ["annual renovation cautions", "directional disturbance concerns", "tai sui and san sha overview"],
      "required_inputs": ["year", "renovation or disturbance plan", "affected direction or sector", "boundary convention near year transition"],
      "references": ["fengshui-master/references/timing-and-date-selection.md"],
      "optional_tools": ["fengshui-master/scripts/annual_afflictions.py"],
      "guardrails": ["not a full almanac", "do not declare a direction impossible to use for the whole year", "permits safety and contractor constraints take priority"],
      "limitations": ["common annual directional scaffold only", "monthly day and personal clash layers are not automated"],
      "adaptation_notes": ["Recommend quiet, cleanliness, reduced disturbance, and practical scheduling before costly cures."]
    },
    {
      "id": "new-moon-full-moon-timing",
      "title": "New moon, full moon, waxing, and waning moon symbolic timing",
      "status": "partially_covered",
      "domains": ["timing", "life_omen", "business", "brand", "product"],
      "supported_questions": ["new moon versus full moon launch", "quiet start timing", "public release timing", "review or clearing timing"],
      "required_inputs": ["candidate date or dates", "event type", "local time zone when precision matters", "practical constraints"],
      "references": ["fengshui-master/references/timing-and-date-selection.md", "fengshui-master/references/classical-source-map.md"],
      "optional_tools": ["fengshui-master/scripts/moon_phase.py"],